{
  "schema_version": 1,
  "environment_mode": "host",
  "state_root": "/var/lib/agent-company",
  "secret_file": null,
  "provider_execution_enabled": false,
  "provider_credential_root": null,
  "telegram_enabled": false,
  "webhook_enabled": true,
  "notifications_enabled": false,
  "scheduler_enabled": false,
  "git_enabled": false
}
